{
	"$schema": "https://shadcn-svelte.com/schema/registry-item.json",
	"name": "marquee",
	"title": "Marquee",
	"type": "registry:block",
	"author": "Chirag Arora <arorachirag12005@gmail.com>",
	"description": "",
	"meta": {
		"author": "TheChirag356",
		"version": "1.0.0",
		"documentation": "https://oriui.app/components/marquee",
		"repository": "https://github.com/TheChirag356/ori-ui"
	},
	"files": [
		{
			"content": "export { default as Marquee } from './marquee.svelte';",
			"type": "registry:file",
			"target": "ori/marquee/index.ts"
		},
		{
			"content": "<script lang=\"ts\">\r\n  import { cn } from \"$LIB$/utils\";\r\n  import type { Snippet } from \"svelte\";\r\n\r\n  type MarqueeProps = {\r\n    pauseOnHover?: boolean;\r\n    vertical?: boolean;\r\n    repeat?: number;\r\n    reverse?: boolean;\r\n    class?: string;\r\n    children?: Snippet;\r\n  };\r\n  let {\r\n    pauseOnHover = false,\r\n    vertical = false,\r\n    repeat = 4,\r\n    reverse = false,\r\n    class: className = \"\",\r\n    children,\r\n  }: MarqueeProps = $props();\r\n</script>\r\n\r\n<div\r\n  class={cn(\r\n    \"group flex overflow-hidden p-2 [--duration:16s] [--gap:3rem] [gap:var(--gap)]\",\r\n    {\r\n      \"flex-row\": !vertical,\r\n      \"flex-col\": vertical,\r\n    },\r\n    className\r\n  )}\r\n>\r\n  {#each { length: repeat } as _, i (i)}\r\n    <div\r\n      class={cn(\"flex shrink-0 justify-around [gap:var(--gap)]\", {\r\n        \"animate-marquee flex-row\": !vertical,\r\n        \"animate-marquee-vertical flex-col\": vertical,\r\n        \"group-hover:paused\": pauseOnHover,\r\n        \"[animation-direction:reverse]\": reverse,\r\n      })}\r\n    >\r\n      {@render children?.()}\r\n    </div>\r\n  {/each}\r\n</div>\r\n\r\n<style>\r\n  @keyframes marquee {\r\n    0% {\r\n      transform: translateX(0%);\r\n    }\r\n    100% {\r\n      transform: translateX(-100%);\r\n    }\r\n  }\r\n\r\n  @keyframes marquee-vertical {\r\n    0% {\r\n      transform: translateY(0%);\r\n    }\r\n    100% {\r\n      transform: translateY(-100%);\r\n    }\r\n  }\r\n\r\n  .animate-marquee {\r\n    animation: marquee var(--duration) linear infinite;\r\n  }\r\n\r\n  .animate-marquee-vertical {\r\n    animation: marquee-vertical var(--duration) linear infinite;\r\n  }\r\n</style>",
			"type": "registry:file",
			"target": "ori/marquee/marquee.svelte"
		}
	]
}