{
	"$schema": "https://shadcn-svelte.com/schema/registry-item.json",
	"name": "glare-hover",
	"title": "Glare Hover",
	"type": "registry:block",
	"author": "Chirag Arora <arorachirag12005@gmail.com>",
	"description": "",
	"meta": {
		"author": "TheChirag356",
		"version": "1.0.0",
		"documentation": "https://oriui.app/components/glare-hover",
		"repository": "https://github.com/TheChirag356/ori-ui"
	},
	"files": [
		{
			"content": "<script lang=\"ts\" module>\r\n\timport { cn, type WithElementRef } from '$LIB$/utils';\r\n\r\n\texport type GlareHoverProps = WithElementRef<HTMLDivElement> & {\r\n\t\tglareColor?: string;\r\n\t\tglareOpacity?: number;\r\n\t\tglareAngle?: number;\r\n\t\tglareSize?: number;\r\n\t\ttransitionDuration?: number;\r\n\t\tplayOnce?: boolean;\r\n\t\twidth?: string;\r\n\t\theight?: string;\r\n\t\tbackground?: string;\r\n\t\tborderRadius?: string;\r\n\t\tborderColor?: string;\r\n\t\tclass?: string;\r\n        style?: Record<string, string>;\r\n\t\tchildren?: () => any;\r\n\t};\r\n</script>\r\n\r\n<script lang=\"ts\">\r\n\tlet {\r\n\t\tclass: className = '',\r\n\t\tchildren,\r\n\t\ttransitionDuration = 650,\r\n\t\tglareSize = 250,\r\n\t\tglareAngle = -45,\r\n\t\tglareOpacity = 0.5,\r\n\t\tglareColor = '#ffffff',\r\n\t\tborderColor = \"#333\",\r\n\t\tborderRadius = \"10px\",\r\n\t\tbackground = \"#000\",\r\n\t\theight = \"500px\",\r\n\t\twidth = \"500px\",\r\n\t\tplayOnce = false,\r\n        style,\r\n\t\t...restProps\r\n\t}: GlareHoverProps = $props();\r\n\r\n    const hex = glareColor.replace(\"#\", \"\");\r\n    let rgba = glareColor;\r\n    if (/^[0-9A-Fa-f]{6}$/.test(hex)) {\r\n        const r = parseInt(hex.substring(0, 2), 16);\r\n        const g = parseInt(hex.substring(2, 4), 16);\r\n        const b = parseInt(hex.substring(4, 6), 16);\r\n        rgba = `rgba(${r}, ${g}, ${b}, ${glareOpacity})`;\r\n    } else if (/^[0-9A-Fa-f]{3}$/.test(hex)) {\r\n        const r = parseInt(hex.charAt(0) + hex.charAt(0), 16);\r\n        const g = parseInt(hex.charAt(1) + hex.charAt(1), 16);\r\n        const b = parseInt(hex.charAt(2) + hex.charAt(2), 16);\r\n        rgba = `rgba(${r}, ${g}, ${b}, ${glareOpacity})`;\r\n    }\r\n\r\n    const vars = {\r\n        '--gh-width': width,\r\n        '--gh-height': height,\r\n        '--gh-background': background,\r\n        '--gh-br': borderRadius,\r\n        '--gh-angle': `${glareAngle}deg`,\r\n        '--gh-duration': `${transitionDuration}ms`,\r\n        '--gh-glare-size': `${glareSize}%`,\r\n        '--gh-rgba': rgba,\r\n        '--gh-border-color': borderColor,\r\n    }\r\n</script>\r\n\r\n<div\r\n\tclass={cn('glare-hover', playOnce ? 'glare-hover-play-once' : '', className)}\r\n\tstyle={{ ...vars, ...style }}\r\n\t{...restProps as any}\r\n>\r\n\t{#if children}\r\n\t\t{@render children()}\r\n\t{/if}\r\n</div>\r\n\r\n<style>\r\n    .glare-hover {\r\n        width: var(--gh-width);\r\n        height: var(--gh-height);\r\n        background: var(--gh-background);\r\n        border-radius: var(--gh-br);\r\n        border: 1px solid var(--gh-border-color);\r\n        overflow: hidden;\r\n        position: relative;\r\n        display: grid;\r\n        place-items: center;\r\n    }\r\n\r\n    .glare-hover::before {\r\n    content: '';\r\n    position: absolute;\r\n    inset: 0;\r\n    background: linear-gradient(\r\n        var(--gh-angle),\r\n        hsla(0, 0%, 0%, 0) 60%,\r\n        var(--gh-rgba) 70%,\r\n        hsla(0, 0%, 0%, 0),\r\n        hsla(0, 0%, 0%, 0) 100%\r\n    );\r\n    transition: var(--gh-duration) ease;\r\n    background-size:\r\n        var(--gh-size) var(--gh-size),\r\n        100% 100%;\r\n    background-repeat: no-repeat;\r\n    background-position:\r\n        -100% -100%,\r\n        0 0;\r\n    }\r\n\r\n    .glare-hover:hover {\r\n        cursor: pointer;\r\n    }\r\n\r\n    .glare-hover:hover::before {\r\n    background-position:\r\n        100% 100%,\r\n        0 0;\r\n    }\r\n\r\n    .glare-hover-play-once::before {\r\n    transition: none;\r\n    }\r\n\r\n    .glare-hover-play-once:hover::before {\r\n    transition: var(--gh-duration) ease;\r\n    background-position:\r\n        100% 100%,\r\n        0 0;\r\n    }\r\n\r\n</style>\r\n",
			"type": "registry:file",
			"target": "ori/glare-hover/glare-hover.svelte"
		},
		{
			"content": "export { default as GlareHover } from \"./glare-hover.svelte\";",
			"type": "registry:file",
			"target": "ori/glare-hover/index.ts"
		}
	]
}