{
	"$schema": "https://shadcn-svelte.com/schema/registry-item.json",
	"name": "slide-text-button",
	"title": "Slide Text Button",
	"type": "registry:block",
	"author": "Chirag Arora <arorachirag12005@gmail.com>",
	"description": "",
	"registryDependencies": [
		"button"
	],
	"meta": {
		"author": "TheChirag356",
		"version": "1.0.0",
		"documentation": "https://oriui.app/components/slide-text-button",
		"repository": "https://github.com/TheChirag356/ori-ui"
	},
	"files": [
		{
			"content": "export { default as SlideTextButton } from \"./slide-text-button.svelte\";",
			"type": "registry:file",
			"target": "ori/slide-text-button/index.ts"
		},
		{
			"content": "<script lang=\"ts\">\n    import { Button } from \"$COMPONENTS$/ui/button\"\n\timport { cn } from \"$LIB$/utils\";\n    import { fly } from \"svelte/transition\";\n    type ButtonProps = {\n        mainText?: string;\n        slideText?: string;\n        class?: string;\n        duration?: number;\n        delay?: number;\n    };\n\n    let isHovering = $state(false);\n\n    let {mainText = \"Hover Me\", slideText = \"This is Ori\", class: className, duration = 200, delay = 0, ...restProps}: ButtonProps = $props();\n</script>\n\n<Button\n\tclass={cn('cursor-pointer relative overflow-hidden', className)}\n\tonmouseenter={() => (isHovering = true)}\n\tonmouseleave={() => (isHovering = false)}\n\tonfocus={() => (isHovering = true)}\n\tonblur={() => (isHovering = false)}\n\taria-label={isHovering ? slideText : mainText}\n\t{...restProps}\n>\n\t<span class=\"invisible whitespace-nowrap\">\n\t\t{mainText.length > slideText.length ? mainText : slideText}\n\t</span>\n\t{#if !isHovering}\n\t\t<div\n\t\t\tclass=\"absolute inset-0 flex items-center justify-center pointer-events-none\"\n\t\t\ttransition:fly={{ y: -20, duration, delay }}\n\t\t\taria-hidden={isHovering}\n\t\t>\n\t\t\t{mainText}\n\t\t</div>\n\t{:else}\n\t\t<div\n\t\t\tclass=\"absolute inset-0 flex items-center justify-center pointer-events-none\"\n\t\t\ttransition:fly={{ y: 20, duration, delay }}\n\t\t\taria-hidden={!isHovering}\n\t\t>\n\t\t\t{slideText}\n\t\t</div>\n\t{/if}\n</Button>\n",
			"type": "registry:file",
			"target": "ori/slide-text-button/slide-text-button.svelte"
		}
	]
}