{
	"$schema": "https://shadcn-svelte.com/schema/registry-item.json",
	"name": "rainbow-button",
	"title": "Rainbow Button",
	"type": "registry:block",
	"author": "Chirag Arora <arorachirag12005@gmail.com>",
	"description": "",
	"registryDependencies": [
		"button"
	],
	"meta": {
		"author": "TheChirag356",
		"version": "1.0.0",
		"documentation": "https://oriui.app/components/rainbow-button",
		"repository": "https://github.com/TheChirag356/ori-ui"
	},
	"files": [
		{
			"content": "export { default as RainbowButton } from \"./rainbow-button.svelte\";",
			"type": "registry:file",
			"target": "ori/rainbow-button/index.ts"
		},
		{
			"content": "<script lang=\"ts\">\r\n\timport { Button, type ButtonProps } from \"$COMPONENTS$/ui/button\";\r\n\timport { cn } from \"$LIB$/utils\";\r\n\r\n\ttype RainbowButtonProps = ButtonProps & {\r\n\t\tchildren?: () => any;\r\n\t\tclass?: string;\r\n\t};\r\n\r\n\tlet {\r\n\t\tclass: className = \"\",\r\n\t\tchildren,\r\n\t\t...restProps\r\n\t}: RainbowButtonProps = $props();\r\n</script>\r\n\r\n<div class=\"rainbow-wrapper relative inline-block rounded-lg\">\r\n\t<div class=\"relative overflow-x-hidden rounded-lg\">\r\n\t\t<Button\r\n\t\t\tclass={cn(\r\n\t\t\t\t'rainbow-button relative cursor-pointer',\r\n\t\t\t\t'inline-flex items-center justify-center gap-2 shrink-0',\r\n\t\t\t\t'px-6 py-3 rounded-lg font-medium',\r\n\t\t\t\t'active:scale-[0.98] transition-[transform,colors,shadow] duration-200 ease-in-out',\r\n\t\t\t\tclassName\r\n\t\t\t)}\r\n\t\t\t{...restProps}\r\n\t\t>\r\n\t\t\t{@render children?.()}\r\n\t\t</Button>\r\n\r\n\t\t<!-- Border -->\r\n\t\t<span class=\"rainbow-border absolute left-0 right-0 bottom-0 h-px pointer-events-none\"></span>\r\n\t</div>\r\n\r\n\t<!-- Glow (not clipped vertically) -->\r\n\t<span class=\"rainbow-glow absolute left-0 right-0 -bottom-1 h-px pointer-events-none\"></span>\r\n</div>\r\n\r\n<style>\r\n:global(.rainbow-wrapper) {\r\n\t--rainbow-gradient: linear-gradient(\r\n\t\t90deg,\r\n\t\t#ff0000,\r\n\t\t#ff7f00,\r\n\t\t#ffff00,\r\n\t\t#00ff00,\r\n\t\t#0000ff,\r\n\t\t#4b0082,\r\n\t\t#9400d3,\r\n\t\t#ff0000\r\n\t);\r\n}\r\n\r\n.rainbow-border,\r\n.rainbow-glow {\r\n\tbackground: var(--rainbow-gradient);\r\n\tbackground-size: 200% 100%;\r\n\tanimation: rainbow-flow 2s linear infinite;\r\n}\r\n\r\n.rainbow-glow {\r\n\tfilter: blur(6px);\r\n\topacity: 0.7;\r\n}\r\n\r\n@keyframes rainbow-flow {\r\n\t0% { background-position: 0% 50%; }\r\n\t100% { background-position: 200% 50%; }\r\n}\r\n</style>\r\n",
			"type": "registry:file",
			"target": "ori/rainbow-button/rainbow-button.svelte"
		}
	]
}