{
	"$schema": "https://shadcn-svelte.com/schema/registry-item.json",
	"name": "morphic-navbar",
	"title": "Morphic Navbar",
	"type": "registry:block",
	"author": "Chirag Arora <arorachirag12005@gmail.com>",
	"description": "",
	"meta": {
		"author": "TheChirag356",
		"version": "1.0.0",
		"documentation": "https://oriui.app/components/morphic-navbar",
		"repository": "https://github.com/TheChirag356/ori-ui"
	},
	"files": [
		{
			"content": "<script lang=\"ts\" module>\r\n    export type MorphicNavbarProps = {\r\n        navItems?: { href: string; name: string }[];\r\n        class?: string;\r\n    };\r\n</script>\r\n\r\n<script lang=\"ts\">\r\n\timport { cn } from \"$LIB$/utils\";\r\n\r\n    let items = [\r\n        { href: \"#\", name: \"home\" },\r\n        { href: \"#works\", name: \"works\" },\r\n        { href: \"#blog\", name: \"blog\" },\r\n        { href: \"#about\", name: \"about\" },\r\n    ] satisfies { href: string; name: string }[];\r\n\r\n    let activePath = $state(\"#\");\r\n\r\n    function isActivePath(path: string) {\r\n        if (path === \"#\" || path === \"/\") {\r\n            return activePath === \"#\" || activePath === \"/\";\r\n        }\r\n        return activePath.startsWith(path);\r\n    }\r\n    let index = $state(0);\r\n    $effect(() => {\r\n        index = items.findIndex(item => isActivePath(item.href));\r\n    })\r\n\r\n    let {navItems = items, class: className = \"\"}: MorphicNavbarProps = $props();\r\n</script>\r\n\r\n<nav class={cn('mx-auto max-w-4xl px-4 py-2', className)}>\r\n\t<div class=\"flex items-center justify-center\">\r\n\t\t<div class=\"glass flex items-center justify-between overflow-hidden rounded-xl transition-all\">\r\n\t\t\t{#each Object.entries(navItems) as [indx, { href, name }], idx (name)}\r\n\t\t\t\t<a\r\n\t\t\t\t\tclass={cn(\r\n\t\t\t\t\t\t'flex items-center justify-center bg-foreground p-1.5 px-4 text-sm text-background transition-all duration-300',\r\n\t\t\t\t\t\tactivePath === href\r\n\t\t\t\t\t\t\t? 'mx-2 rounded-xl font-semibold text-sm'\r\n\t\t\t\t\t\t\t: cn(idx === index - 1 ? 'rounded-r-xl' : '', idx === index + 1 ? 'rounded-l-xl' : '')\r\n\t\t\t\t\t)}\r\n\t\t\t\t\t{href}\r\n\t\t\t\t\tonclick={() => {\r\n\t\t\t\t\t\tactivePath = href;\r\n\t\t\t\t\t}}>{name}</a\r\n\t\t\t\t>\r\n\t\t\t{/each}\r\n\t\t</div>\r\n\t</div>\r\n</nav>\r\n",
			"type": "registry:file",
			"target": "ori/morphic-navbar/morphic-navbar.svelte"
		}
	]
}