{
	"$schema": "https://shadcn-svelte.com/schema/registry-item.json",
	"name": "video-text",
	"title": "Video Text",
	"type": "registry:block",
	"author": "Chirag Arora <arorachirag12005@gmail.com>",
	"description": "",
	"meta": {
		"author": "TheChirag356",
		"version": "1.0.0",
		"documentation": "https://oriui.app/components/video-text",
		"repository": "https://github.com/TheChirag356/ori-ui"
	},
	"files": [
		{
			"content": "export { default as VideoText } from './video-text.svelte';",
			"type": "registry:file",
			"target": "ori/video-text/index.ts"
		},
		{
			"content": "<script lang=\"ts\">\r\n\timport { cn } from \"$LIB$/utils\";\r\n\r\n\ttype Props = {\r\n\t\tsrc: string;\r\n\t\tclass?: string;\r\n\t\tautoplay?: boolean;\r\n\t\tmuted?: boolean;\r\n\t\tloop?: boolean;\r\n\t\tpreload?: \"auto\" | \"metadata\" | \"none\";\r\n\r\n\t\ttext: string;\r\n\r\n\t\tfontSize?: string | number;\r\n\t\tfontWeight?: string | number;\r\n\t\ttextAnchor?: string;\r\n\t\tdominantBaseline?: string;\r\n\t\tfontFamily?: string;\r\n\r\n\t\tas?: keyof HTMLElementTagNameMap;\r\n\t};\r\n\r\n\tlet {\r\n\t\tsrc,\r\n\t\tclass: className = \"\",\r\n\t\tautoplay = true,\r\n\t\tmuted = true,\r\n\t\tloop = true,\r\n\t\tpreload = \"auto\",\r\n\r\n\t\ttext,\r\n\r\n\t\tfontSize = 20,\r\n\t\tfontWeight = \"bold\",\r\n\t\ttextAnchor = \"middle\",\r\n\t\tdominantBaseline = \"middle\",\r\n\t\tfontFamily = \"sans-serif\",\r\n\r\n\t\tas = \"div\"\r\n\t}: Props = $props();\r\n\r\n\tlet svgMask = $state(\"\");\r\n\r\n\tfunction updateSvgMask() {\r\n\t\tconst responsiveFontSize =\r\n\t\t\ttypeof fontSize === \"number\" ? `${fontSize}vw` : fontSize;\r\n\r\n\t\tsvgMask = `\r\n<svg xmlns='http://www.w3.org/2000/svg' width='100%' height='100%'>\r\n\t<text\r\n\t\tx='50%'\r\n\t\ty='50%'\r\n\t\tfont-size='${responsiveFontSize}'\r\n\t\tfont-weight='${fontWeight}'\r\n\t\ttext-anchor='${textAnchor}'\r\n\t\tdominant-baseline='${dominantBaseline}'\r\n\t\tfont-family='${fontFamily}'\r\n\t\tfill='white'\r\n\t>\r\n\t\t${text}\r\n\t</text>\r\n</svg>`;\r\n\t}\r\n\r\n\t$effect(() => {\r\n\t\tupdateSvgMask();\r\n\t\twindow.addEventListener(\"resize\", updateSvgMask);\r\n\t\treturn () => window.removeEventListener(\"resize\", updateSvgMask);\r\n\t});\r\n\r\n\tlet dataUrlMask = $derived(`url(\"data:image/svg+xml,${encodeURIComponent(svgMask)}\")`);\r\n</script>\r\n\r\n<svelte:element this={as} class={cn(\"relative size-full overflow-hidden\", className)}>\r\n\t<div\r\n\t\tclass=\"absolute inset-0 flex items-center justify-center\"\r\n\t\tstyle={` \r\n\t\t\tmask-image: ${dataUrlMask};\r\n\t\t\t-webkit-mask-image: ${dataUrlMask};\r\n\t\t\tmask-size: contain;\r\n\t\t\t-webkit-mask-size: contain;\r\n\t\t\tmask-repeat: no-repeat;\r\n\t\t\t-webkit-mask-repeat: no-repeat;\r\n\t\t\tmask-position: center;\r\n\t\t\t-webkit-mask-position: center;\r\n\t\t`}\r\n\t>\r\n\t\t<video class=\"h-full w-full object-cover\" {autoplay} {muted} {loop} {preload} playsinline>\r\n\t\t\t<source src={src} />\r\n\t\t</video>\r\n\t</div>\r\n\r\n\t<!-- SEO / a11y fallback -->\r\n\t<span class=\"sr-only\">{text}</span>\r\n</svelte:element>\r\n",
			"type": "registry:file",
			"target": "ori/video-text/video-text.svelte"
		}
	]
}