{
	"$schema": "https://shadcn-svelte.com/schema/registry-item.json",
	"name": "spinning-text",
	"title": "Spinning Text",
	"type": "registry:block",
	"author": "Chirag Arora <arorachirag12005@gmail.com>",
	"description": "",
	"meta": {
		"author": "TheChirag356",
		"version": "1.0.0",
		"documentation": "https://oriui.app/components/spinning-text",
		"repository": "https://github.com/TheChirag356/ori-ui"
	},
	"files": [
		{
			"content": "export { default as SpinningText } from './spinning-text.svelte';",
			"type": "registry:file",
			"target": "ori/spinning-text/index.ts"
		},
		{
			"content": "<script lang=\"ts\">\n  // Props\n  export let text: string = \"\";\n  // Speed of a full rotation in seconds (renamed from duration for clarity)\n  export let speed: number = 10;\n  export let reverse: boolean = false;   // reverse direction\n  export let radius: number = 100;       // radius in px\n  export let className: string = \"\";     // extra classes\n</script>\n\n{#if text.length > 0}\n\t<div\n\t\tclass={`relative inline-block ${className}`}\n\t\tstyle=\"\n    width: {radius * 2}px;\n    height: {radius * 2}px;\n  \"\n\t>\n\t\t<div\n\t\t\tclass=\"spinning-container\"\n\t\t\tstyle=\"\n      animation-duration: {speed}s;\n      animation-direction: {reverse ? 'reverse' : 'normal'};\n    \"\n\t\t>\n\t\t\t{#each text.split('') as char, i (i)}\n\t\t\t\t<span\n\t\t\t\t\tclass=\"spinning-char\"\n\t\t\t\t\tstyle=\"\n          transform: rotate({(360 / text.length) * i}deg)\n            translate({radius}px) rotate({-(360 / text.length) * i}deg);\n        \"\n\t\t\t\t>\n\t\t\t\t\t{char}\n\t\t\t\t</span>\n\t\t\t{/each}\n\t\t</div>\n\t</div>\n{/if}\n\n<style>\n  .spinning-container {\n    position: absolute;\n    inset: 0;\n    display: flex;\n    align-items: center;\n    justify-content: center;\n    animation: spin linear infinite;\n  }\n\n  .spinning-char {\n    position: absolute;\n    top: 50%;\n    left: 50%;\n    transform-origin: 0 0;\n    white-space: pre;\n  }\n\n  @keyframes spin {\n    to { transform: rotate(360deg); }\n  }\n</style>\n",
			"type": "registry:file",
			"target": "ori/spinning-text/spinning-text.svelte"
		}
	]
}